,Date,Category,Section,Headline,Subheader,Term,URL
1192,2018-11-05,US New,Politics,"Facing Threats and Bias, L.G.B.T. Candidates Are Running in Record Numbers","A record number of lesbian, gay, bisexual and transgender people are running in the midterms, despite facing a hostile White House and a growing number of bias incidents.",Transgender,/2018/11/05/us/politics/lgbt-candidates.html?searchResultPosition=19
1193,2018-11-07,US New,Politics,"In ‘Rainbow Wave,’ L.G.B.T. Candidates Are Elected in Record Numbers","More than 150 L.G.B.T. candidates were elected nationwide, and Massachusetts voted to uphold a state law protecting transgender people from discrimination.",Transgender,/2018/11/07/us/politics/lgbt-election-winners-midterms.html?searchResultPosition=15
1194,2018-11-12,US New,Politics,Can a Fired Transgender Worker Sue for Job Discrimination?,A federal law bars sex discrimination. The Supreme Court is considering taking up cases on whether it covers bias against gay and transgender people.,Transgender,/2018/11/12/us/politics/transgender-job-discrimination.html?searchResultPosition=11
1195,2018-11-19,Life,Family,Some Schools Allow Children to Register With a Gender Option Besides Girl or Boy,"The term “nonbinary” on school forms signals a new inclusiveness, experts say.",Other,/2018/11/19/well/family/some-schools-allow-children-to-register-with-a-gender-option-besides-girl-or-boy.html?searchResultPosition=14
1196,2018-11-21,Arts,Style,Another Hot Take on the Term ‘Latinx’,"This week in El Espace: gender-bending, big news for bookworms and more.",Other,/2018/11/21/style/latinx-queer-gender-nonconforming.html?searchResultPosition=624
1197,2018-11-22,Arts,Movies,‘Family in Transition’ Review: A Parent Prepares for Change,"The documentary tells the story of Amit Tsuk, who comes out as transgender, and the effect it has on the family.",Transgender,/2018/11/22/movies/family-in-transition-review.html?searchResultPosition=13
1198,2018-11-23,US New,Politics,Trump Asks Supreme Court for Fast Appeal on Transgender Military Ban,"In what has become an increasingly common move for the Trump administration, it asked the justices to step in before lower courts have ruled.",Transgender,/2018/11/23/us/politics/trump-transgender-ban-supreme-court.html?searchResultPosition=6
1199,2018-11-26,Misc,Letters,Medical Care for Transgender Adults,The writer of an Atlantic cover story takes issue with a Sunday Review essay.,Transgender,/2018/11/26/opinion/letters/transgender-medical-care.html?searchResultPosition=2
1200,2018-11-27,US New,U.S.,Independent Autopsy of Transgender Asylum Seeker Who Died in ICE Custody Shows Signs of Abuse,"The autopsy raised questions about how Roxsana Hernandez Rodriguez, 33, a transgender woman from Honduras, was treated in custody before she died from illness.",Transgender,/2018/11/27/us/trans-woman-roxsana-hernandez-ice-autopsy.html?searchResultPosition=4
1201,2018-11-29,Misc,Opinion,How Twitter’s Ban on ‘Deadnaming’ Promotes Free Speech,Trans people are less likely to speak up if they know they’re going to be constantly told they don’t exist.,Other,/2018/11/29/opinion/twitter-deadnaming-ban-free-speech.html?searchResultPosition=10
1202,2018-11-29,Misc,Letters,Feeling Better After Gender Transition,Readers say bad outcomes are rare.,Other,/2018/11/29/opinion/letters/gender-transition.html?searchResultPosition=76
1203,2018-11-30,Arts,Book Review,An Unapologetically Feminist Western Novel,"With “Heresy,” Melissa Lenhardt has delivered an all-out women-driven, queer, transgender, multiracial takeover of the Old West.",Transgender,/2018/11/30/books/review/melissa-lenhardt-heresy.html?searchResultPosition=443
1204,2018-12-03,Misc,Opinion,Why Are Gender Reveal Parties a Thing?,They say a lot more about our culture than they do about the sex of our soon-to-be children.,Other,/2018/12/03/opinion/gender-reveal-party.html?searchResultPosition=9
1205,2018-12-04,Arts,Style,My 15-Year-Old Daughter Told Me She’s Pansexual and Dating a Transgender Boy. I’m Struggling.,A mother wonders how to support the child she doesn’t entirely understand. ,Transgender,/2018/12/04/style/pansexual-daughter-transgender-parenting.html?searchResultPosition=3
1206,2018-12-06,Misc,Opinion,Being Trans Is Not a Mental Disorder,When will the American Psychiatric Association finally stop treating it like it is? ,Other,/2018/12/06/opinion/trans-gender-dysphoria-mental-disorder.html?searchResultPosition=7
1207,2018-12-14,World News,Europe,Not Male or Female? Germans Can Now Choose ‘Diverse’,German lawmakers approved a third option for legal documents in response to a landmark court case that said gender identity was a personal freedom.,Other,/2018/12/14/world/europe/transgender-germany-diverse.html?searchResultPosition=5
1208,2018-12-18,US New,Americas,"Transgender Woman’s Murder Is Prosecuted as ‘Feminicide,’ in First for Colombia",Anyela Ramos Claros was shot multiple times by a man who sought to justify his actions by citing Ms. Claros’s sexual orientation.,Transgender,/2018/12/18/world/americas/transgender-woman-shot-colombia-feminicide.html?searchResultPosition=1
1209,2018-12-19,Misc,The Upshot,Twelve Books for Feminist Boys and Girls ,"Most parents say they want to raise boys and girls as equals, but children absorb gender stereotypes early on. New children’s books help combat them. ",Other,/2018/12/19/upshot/twelve-books-for-feminist-boys-and-girls.html?searchResultPosition=655
1210,2019-01-02,Arts,Movies,Is a Film About a Transgender Dancer Too ‘Dangerous’ to Watch?,That’s what trans activists say about the Netflix drama “Girl.” But the movie’s supporters say it’s something cisgender viewers need to see.,Transgender,/2019/01/02/movies/girl-netflix-film-transgender-debate.html?searchResultPosition=75
1211,2019-01-04,US New,New York,"How Thomas Page McBee, Questioner of Masculinity, Spends His Sundays","The writer and former boxer, the first transgender man to compete in Madison Square Garden, works out at the “Broad City” gym and goes to movies solo.",Transgender,/2019/01/04/nyregion/how-thomas-page-mcbee-questioner-of-masculinity-spends-his-sundays.html?searchResultPosition=193
1212,2019-01-08,Misc,Opinion,Coming Out as Trans Isn’t a Teenage Fad ,Conservatives are inventing a “syndrome” to undermine young people’s transitions.,Other,/2019/01/08/opinion/trans-teen-transition.html?searchResultPosition=186
1213,2019-01-08,Misc,Opinion,Two Women Enter a Temple. A Country Erupts.,"The debate over whether women of childbearing age can visit a shrine in southern India has become a battle involving caste, gender, party politics and history.",Other,/2019/01/08/opinion/india-women-sabarimala-temple.html?searchResultPosition=552
1214,2019-01-10,US New,U.S.,2 North Carolina Women Charged With Sexually Assaulting Transgender Woman in Bar,"In a 911 call, a transgender woman described being verbally harassed and groped by two women in the restroom of a popular bar in downtown Raleigh, N.C.",Transgender,/2019/01/10/us/transgender-woman-sexual-assault-nc.html?searchResultPosition=95
1215,2019-01-11,US New,Politics,"Supreme Court Takes Eight Cases, but Doesn’t Act on Some Big Ones","If the court is to hear major cases this term on immigration, transgender service in the military, gay rights, abortion or guns, it must act soon.",Transgender,/2019/01/11/us/politics/supreme-court-new-cases.html?searchResultPosition=187
1216,2019-01-11,US New,U.S.,Alabama Woman Becomes First Known Transgender Person Killed This Year in U.S.,"Dana Martin, a transgender woman from Hope Hull, Ala., was found shot to death in a vehicle in Montgomery.",Transgender,/2019/01/11/us/transgender-black-woman-killed.html?searchResultPosition=94
1217,2019-01-18,Life,Your Money,"In California, Gender Can No Longer Be Considered in Setting Car Insurance Rates",The state’s change could alter prices for scores of people.,Other,/2019/01/18/your-money/car-insurance-gender-california.html?searchResultPosition=551
1218,2019-01-22,Misc,Opinion,The Supreme Court Just Ended My Military Career,The justices chose not to protect the rights of transgender patriots like me.,Transgender,/2019/01/22/opinion/transgender-ban-supreme-court-military.html?searchResultPosition=171
1219,2019-01-22,US New,Politics,Supreme Court Revives Transgender Ban for Military Service,"By a 5-to-4 vote, justices temporarily stayed trial court decisions blocking the policy while litigation in the lower courts moves forward.",Transgender,/2019/01/22/us/politics/transgender-ban-military-supreme-court.html?searchResultPosition=97
1220,2019-01-23,Misc,Opinion,Trump’s Transgender Military Ban Gets a Boost,There was no need for the Supreme Court to reinstate a misguided ban on transgender service members.,Transgender,/2019/01/23/opinion/trump-transgender-military-ban.html?searchResultPosition=72
1221,2019-01-28,Misc,Obituaries,"Frances Grill, 90, Founder of an Inclusive Modeling Agency, Dies","At Click there have been white models (Elle Macpherson, Isabella Rossellini, Uma Thurman), black (Whitney Houston, Gail O’Neill) and transgender (Teri Toye).",Transgender,/2019/01/28/obituaries/frances-grill-founder-of-an-inclusive-modeling-agency-dies-at-90.html?searchResultPosition=272
1222,2019-02-01,Arts,Movies,Oscars Rewind: When a Woman Won for Playing a Male Character,Linda Hunt made history in 1984 as the first actress to play a cisgender character of the opposite sex in “The Year of Living Dangerously.”,Other,/2019/02/01/movies/linda-hunt-oscars.html?searchResultPosition=428
1223,2019-02-05,Misc,Lens,Women of Color Organize for Access and Accountability in Photojournalism,"The Authority Collective, whose members are women, transgender or nonbinary photographers, is building a supportive community while challenging industry leaders’ thinking about diversity and representation.",Transgender,/2019/02/05/lens/women-of-color-photojournalism-authority-collective.html?searchResultPosition=216
1224,2019-02-07,Misc,Opinion,How British Feminism Became Anti-Trans,A surprisingly mainstream movement of feminists known as TERFs oppose transgender rights as a symptom of “female erasure.”,Transgender,/2019/02/07/opinion/terf-trans-women-britain.html?searchResultPosition=192
1225,2019-02-08,Misc,Obituaries,"Barbra Siperstein, Crusader for Transgender Rights, Dies at 76","Married with three children, she became a vigorous advocate after her wife died. Her name is on a new New Jersey law on gender identity.",Transgender,/2019/02/08/obituaries/barbra-siperstein-dead.html?searchResultPosition=80
1226,2019-02-14,US New,U.S.,"Transgender Man Awarded $120,000 in Discrimination Case at Iowa Prison",Jesse Vroegh had sued for access to the men’s restrooms and locker rooms and for health care benefits at the prison where he worked.,Transgender,/2019/02/14/us/transgender-nurse-discrimination-case.html?searchResultPosition=91
1227,2019-02-15,US New,New York,"How a Trans Soldier Took On the Jail That Denied Her Medication, and Won","She began her transition during a tour of Iraq. When jail doctors on Long Island denied her hormone therapy, her body turned on her. Now they owe her $355,000.",Other,/2019/02/15/nyregion/transgender-jail-hormone-therapy.html?searchResultPosition=179
1228,2019-02-15,Life,Business,U.S. Airlines to Offer New Gender Options for Non-Binary Passengers,"American, Delta and United are among the carriers planning to allow passengers to choose something other than ‘male’ or ‘female’ when buying their tickets.",Other,/2019/02/15/business/airline-travel-gender-choices.html?searchResultPosition=174
1229,2019-02-19,Arts,Style,"Finding Clothes, and Identity, Outside Men’s and Women’s Wear","More clothing companies are trying to meet the demands of a changing clientele, offering gender-bending, gender-fluid and gender-neutral items.",Other,/2019/02/19/style/gender-neutral-clothing.html?searchResultPosition=214
1230,2019-02-22,Misc,Obituaries,"Jackie Shane, Transgender Pioneer of 1960s Soul Music, Dies at 78","Ms. Shane grew up black and transgender in the Jim Crow South, became a star in Canada, then left the stage, returning in 2017 with a Grammy-nominated album.",Transgender,/2019/02/22/obituaries/jackie-shane-dead.html?searchResultPosition=82
1231,2019-03-09,US New,U.S.,Transgender Troops Caught Between a Welcoming Military and a Hostile Government,"In interviews, dozens of transgender troops said that they felt supported in the armed services, despite the Trump administration’s fight to keep them out.",Transgender,/2019/03/09/us/transgender-troops-military.html?searchResultPosition=102
1232,2019-03-11,US New,New York,She Said She Hated White People. Then She Attacked With Pepper Spray.,A transgender woman has been charged with assault as a hate crime for spraying people in the Bronx. The police are asking her about similar attacks in Manhattan.,Transgender,/2019/03/11/nyregion/transgender-pepper-spray-attack.html?searchResultPosition=189
1233,2019-03-12,Arts,Arts,Looking Beyond the Fashion Binary,A “gender-bending” exhibition at the Museum of Fine Arts in Boston rethinks everything about what a fashion show should be.,Other,/2019/03/12/arts/gender-fashion-boston-mfa.html?searchResultPosition=543
1234,2019-03-13,US New,Politics,Transgender and Gun Rights Are Sticking Points for Violence Against Women Act,"While a reauthorization of the Violence Against Women Act passed the House Judiciary Committee, partisan debate over social issues could slow its final passage.",Transgender,/2019/03/13/us/politics/violence-against-women-act-transgender-guns.html?searchResultPosition=105
1235,2019-03-13,US New,U.S.,"New Rule for Transgender Troops: Stick to Your Birth Sex, or Leave","The Pentagon says it will stop allowing transgender troops to transition while in uniform, or to serve in other than their biological sex. Critics call the policy an unconstitutional ban in disguise.",Transgender,/2019/03/13/us/transgender-troops-ban.html?searchResultPosition=81
1236,2019-03-14,US New,U.S.,Florida Surgeon Resigns Over Instagram Photos of Transgender Patients’ Genitals,"“The purpose really was to be educational with it, but it went awry,” Dr. Christopher Salgado said.",Transgender,/2019/03/14/us/transgender-surgeon-patient-photos.html?searchResultPosition=85
1237,2019-03-15,Arts,Movies,‘Girl’ Review: A Transgender Portrait of Uncommon Depth,This divisive film about a young dancer wisely disposes of “will they find out?” questions in favor of psychological depth and verisimilitude.,Transgender,/2019/03/15/movies/girl-review.html?searchResultPosition=79
1238,2019-03-21,US New,Politics,Coast Guard’s Top Officer Pledges ‘Dedicated Campaign’ to Improve Diversity,"The commandant said the service, which has struggled to attract minorities, would bolster its efforts, though he admitted the military’s transgender policy could create a challenge.",Transgender,/2019/03/21/us/politics/coast-guard-diversity.html?searchResultPosition=169
1239,2019-03-23,US New,U.S.,"‘I Can’t Be Myself Here’: At the Border, Transgender Women Navigate 2 Worlds","For many transgender women, crossing between the United States and Mexico can also mean moving uncomfortably between genders.",Transgender,/2019/03/23/us/transgender-women-border-mexico.html?searchResultPosition=104
1240,2019-03-25,US New,U.S.,How Much Is Your Data Worth?,Monday: Exploring Gov. Gavin Newsom’s data dividend idea; living as a transgender woman on the border; and shooting a multicamera sitcom outdoors,Transgender,/2019/03/25/us/newsom-hertzberg-data-dividend.html?searchResultPosition=310
1241,2019-03-27,Arts,Style,"Bar or Bat Mitzvah? Hey, What About a Both Mitzvah?",The Jewish coming-of-age ceremony stretches to accommodate the new gender fluidity.,Other,/2019/03/27/style/gender-fluid-bar-bat-mitzvah.html?searchResultPosition=181
1242,2019-04-01,Misc,Opinion,Who Counts as a Woman?,The attempt to exclude trans women from the ranks of women reinforces the dangerous idea that there is a right way to be female.,Other,/2019/04/01/opinion/trans-women-feminism.html?searchResultPosition=197
1243,2019-04-03,Misc,Opinion,Is Being Trans Like Being an Immigrant?,Both involve a journey. And both are under assault by this administration.,Other,/2019/04/03/opinion/is-being-trans-like-being-an-immigrant.html?searchResultPosition=255
1244,2019-04-04,US New,U.S.,Like ‘Stepping on a Rake’: A Wave of Scandals Hits North Carolina Republicans,"Seven years ago, the party set out to transform the historically moderate state into a considerably more conservative one. But a string of scandals might have set them back.",Other,/2019/04/04/us/north-carolina-republicans.html?searchResultPosition=250
1245,2019-04-04,World News,Europe,"Video of Assault on Transgender Woman in Paris Spurs Outrage, and a Shift",The video shows men at a demonstration this weekend against the ailing president of Algeria taunting and hitting the woman.,Transgender,/2019/04/04/world/europe/transgender-woman-attacked-paris.html?searchResultPosition=86
1246,2019-04-05,US New,Politics,Barr Orders Investigations of Discrimination at F.B.I. and Bureau of Prisons,"The attorney general sought to allay concerns among members of a Justice Department group that advocates on behalf of gay, lesbian and transgender employees.",Transgender,/2019/04/05/us/politics/barr-justice-department-gay-lesbian-transgender-employees.html?searchResultPosition=167
1247,2019-04-10,Arts,Art & Design,Fashion for a Blurring Binary,"A show at the Museum of Fine Arts, Boston tracks gender-bending through a century of clothing that defied rigid rules of sexuality.",Other,/2019/04/10/arts/design/museum-of-fine-arts-boston-fashion-review.html?searchResultPosition=630
1248,2019-04-11,Arts,Movies,‘The Most Dangerous Year’ Review: A Personal Look at Transgender Rights,"The director, Vlada Knowlton, who also narrates, is the parent of a transgender daughter.",Transgender,/2019/04/11/movies/the-most-dangerous-year-review.html?searchResultPosition=96
1249,2019-04-11,Life,Self-Care,Excavating My Childhood Photos — and Myself,I wanted to uncover ancient shards of my childhood gender and piece them back into the whole.,Other,/2019/04/11/style/self-care/nonbinary-childhood-photos-jacob-tobia.html?searchResultPosition=170
1250,2019-04-14,US New,U.S.,"Morehouse College, a Traditionally Black All-Male School, Says It Will Accept Transgender Men","The policy, which was announced on Saturday, will continue to ban from enrollment women anyone who identifies as a woman.",Transgender,/2019/04/14/us/morehouse-college-transgender.html?searchResultPosition=88
1251,2019-04-15,US New,U.S.,"In Attack on Transgender Woman, Dallas Man Was Offered $200, Police Say","The authorities were investigating the episode, which was described by the mayor as an attack of “mob violence.” It is being investigated as a possible hate crime.",Transgender,/2019/04/15/us/transgender-woman-dallas.html?searchResultPosition=78
1252,2019-04-17,Misc,Opinion,Flying While Trans,The T.S.A. subjects transgender passengers like me to humiliating and dehumanizing treatment.,Transgender,/2019/04/17/opinion/tsa-transgender.html?searchResultPosition=163
1253,2019-04-20,Misc,Letters,Eloquent Voices: Teens React to The Times,"High schoolers offer their views on violence in El Salvador, suicide, transgender people, leggings, Asian stereotypes and more.",Transgender,/2019/04/20/opinion/letters/high-school-students-letters-new-york-times.html?searchResultPosition=783
1254,2019-04-22,Misc,Opinion,Will the Supreme Court Protect Gay and Transgender Workers?,The justices have agreed to decide if federal employment law covers discrimination against L.G.B.T. members of the work force.,Transgender,/2019/04/22/opinion/supreme-court-lgbt-workers.html?searchResultPosition=89
1255,2019-04-22,US New,Politics,Supreme Court to Decide Whether Landmark Civil Rights Law Applies to Gay and Transgender Workers,The justices must decide if a law that forbids employment discrimination based on sex also bars discrimination based on sexual orientation or transgender status.,Transgender,/2019/04/22/us/politics/supreme-court-gay-transgender-employees.html?searchResultPosition=108
1256,2019-04-24,US New,Politics,"At She the People Forum, 2020 Candidates Speak Directly to Women of Color","Eight Democratic presidential candidates took questions on racial, gender and economic justice, addressing a crucial constituency in the primary.",Other,/2019/04/24/us/politics/she-the-people-forum-2020-women.html?searchResultPosition=527
1257,2019-04-26,World News,Europe,A Trans Woman Got 3 Minutes to Speak in Armenia’s Parliament. Threats Followed.,"Lilit Martirosyan was the first transgender woman to speak in Armenia’s National Assembly, according to organizers. The backlash began immediately.",Transgender,/2019/04/26/world/europe/armenia-transgender.html?searchResultPosition=159
1258,2019-04-26,Arts,Style,Turning 125 Years Old,"Benefits were held for the Lesbian, Gay, Bisexual & Transgender Community Center, the Lenox Hill Neighborhood House and WNET.",Transgender,/2019/04/26/style/turning-125-years-old.html?searchResultPosition=158
1259,2019-05-01,Arts,Fashion,There Are New Options in Trans Underwear,Companies find inventive ways to accommodate surgical procedures and sizing challenges while also challenging “heteronormative ideas of sexy.”,Other,/2019/05/01/fashion/transgender-underwear.html?searchResultPosition=156
1260,2019-05-01,Arts,Style,"Patti Harrison Bucks Transgender Stereotypes, One Joke at a Time","Her appearance on “The Tonight Show,” skewering President Trump’s transgender military ban, led to a role on “Shrill” and writing duties on “Big Mouth.”",Transgender,/2019/05/01/style/patti-harrison-trans-actress-comedian.html?searchResultPosition=71
1261,2019-05-03,Arts,Television,How Trans Actors Are Rewriting the Rules of TV Casting,"Jen Richards, Brian Michael Smith and others are challenging the TV industry to consider trans performers for roles having nothing to do with their gender identity.",Other,/2019/05/03/arts/television/transgender-actors-tv-casting.html?searchResultPosition=157
1262,2019-05-16,Arts,Art & Design,An Art Show for Hundreds of Women. And That’s Just the Artists.,"Like so many good ideas, the Every Woman Biennial was born of a joke. Now it’s in its third edition, displaying the work of over 600 female and nonbinary artists, and expanding to Los Angeles.",Other,/2019/05/16/arts/design/every-woman-biennial.html?searchResultPosition=566
1263,2019-05-16,Misc,Move,Fitness for Bodies That Don’t Fit the Mainstream,Workouts tailored to the needs of transgender people who want to build strength after surgery.,Transgender,/2019/05/16/well/move/transgender-fitness.html?searchResultPosition=150
1264,2019-05-17,US New,Politics,House Equality Act Extends Civil Rights Protections to Gay and Transgender People,"The House passed legislation prohibiting discrimination on the basis of sexual orientation and gender identity, but the White House and Republican Senate oppose it.",Transgender,/2019/05/17/us/politics/equality-act.html?searchResultPosition=99
1265,2019-05-19,US New,U.S.,A Transgender Woman Who Was Attacked in Dallas Last Month Has Been Found Dead,"When Muhlaysia Booker was attacked in April, it made headlines. One month later, she was shot and killed. The police have not linked the two episodes.",Transgender,/2019/05/19/us/muhlaysia-booker-shot.html?searchResultPosition=83
1266,2019-05-22,Arts,Style,Girls’ Side and Boys’ Side? Not at These Summer Camps,"Sleep-away programs for L.G.B.T.Q. youth offer all the standards — s’mores, canoeing, friendship bracelets — plus gender-inclusive cabins and courses on identity.",Other,/2019/05/22/style/lgbt-summer-camps.html?searchResultPosition=147
1267,2019-05-23,Arts,Book Review,Two L.G.B.T.Q. Memoirs Sow the Seeds of Progress,Jacob Tobia’s “Sissy” and Samantha Allen’s “Real Queer America” speak from outside the stereotypes of trans narratives.,Other,/2019/05/23/books/review/jacob-tobia-sissy-samantha-allen-real-queer-america.html?searchResultPosition=145
1268,2019-05-24,US New,Politics,Trump Administration Proposes Rollback of Transgender Protections,"The Department of Health and Human Services proposed to roll back Obama-era protections of transgender people, narrowing the definition of sex for health care coverage.",Transgender,/2019/05/24/us/politics/donald-trump-transgender-protections.html?searchResultPosition=67
1269,2019-05-26,Arts,Television,Asia Kate Dillon: ‘This Is Who I Am’,"The nonbinary actor, who plays nonbinary characters in “Billions” and the new “John Wick” film, wants to expand the conversation around gender identity, onscreen and off.",Other,/2019/05/26/arts/television/asia-kate-dillon-billions.html?searchResultPosition=146
1270,2019-05-29,US New,Politics,Man in Critical Condition After Setting Himself on Fire Near the White House,"The Secret Service cleared the area of people, including a group protesting the Trump administration’s plan to roll back protections for transgender individuals.",Transgender,/2019/05/29/us/politics/immolation-white-house.html?searchResultPosition=178
1271,2019-05-29,Misc,Opinion,I Thought I’d Seen the Worst of Trump,Then I learned about his plans to take away health care protections for transgender Americans.,Transgender,/2019/05/29/opinion/i-thought-id-seen-the-worst-of-trump.html?searchResultPosition=141
1272,2019-05-29,US New,U.S.,Which Box Do You Check? Some States Are Offering a Nonbinary Option,"As nonbinary teenagers push for driver’s licenses that reflect their identity, a fraught debate over the nature of gender has arrived in the nation’s statehouses.",Other,/2019/05/29/us/nonbinary-drivers-licenses.html?searchResultPosition=143
