,Date,Category,Section,Headline,Subheader,Term,URL
414,2013-11-20,US New,New York,Charge Is Dropped in Beating Death in Harlem,"Doubts surfaced about an initial suspect in the August death of Islan Nettles, a transgender woman, after another man came forward to confess.",Transgender,/2013/11/20/nyregion/charge-is-dropped-in-beating-death-in-harlem.html?searchResultPosition=113
415,2013-11-27,World News,Asia Pacific,"With Glut of Lonely Men, China Has an Approved Outlet for Unrequited Lust","The Guangzhou National Sex Culture Festival is where hedonism meets capitalism in China, and its mostly male visitors reflect the country’s gender imbalance.",Other,/2013/11/27/world/asia/with-glut-of-lonely-men-china-has-an-approved-outlet-for-unrequited-lust.html?searchResultPosition=519
416,2013-11-28,Arts,Fashion,Some Still Like It Hot,"As a new crop of cross-dressing actors, including Jared Leto in “Dallas Buyers Club,” appears in drag, a fresh look at some of the best in the genre, then and now.",Other,/2013/11/28/fashion/Jared-Leto-is-part-of-a-new-crop-of-cross-dressing-actors-in-drag.html?searchResultPosition=571
417,2013-12-01,US New,New York,The Masculine Mystique,"Daniel Friedman, 34, who owns Bindle and Keep in Brooklyn, finds his niche in the fashion industry by giving female and transgender clients a masculine look, one that fits their bodies.",Transgender,/2013/12/01/nyregion/custom-suits-to-make-transgender-and-female-clients-feel-handsome.html?searchResultPosition=161
418,2013-12-03,US New,U.S.,"For Gay Community, Finding Acceptance Is Even More Difficult on the Streets","San Francisco is reaching out to gays who are homeless, after a survey found nearly 30 percent of the city’s homeless population identified as gay, lesbian, bisexual or transgender.",Transgender,/2013/12/03/us/for-gay-community-finding-acceptance-is-even-more-difficult-on-the-streets.html?searchResultPosition=145
419,2013-12-08,Misc,Sunday Review,The Case for Filth,The only possible solution to the gender divide on housework is for everyone to do a lot less of it.,Other,/2013/12/08/opinion/sunday/the-case-for-filth.html?searchResultPosition=602
420,2013-12-16,Misc,Opinion,India's Troubling Reversal on Gay Rights,"As the country's Supreme Court backtracks on gay, lesbian, bisexual and transgender rights, activism will make all the difference.",Transgender,/2013/12/16/opinion/indias-troubling-reversal-on-gay-rights.html?searchResultPosition=198
421,2013-12-17,Misc,Opinion,A Transgender Volunteer for the Salvation Army,How do you weigh discrimination against a legacy of good works?,Transgender,/2013/12/17/opinion/boylan-a-transgender-volunteer-for-the-salvation-army.html?searchResultPosition=41
422,2013-12-24,Science,Health,Gynecology’s Gender Question,A medical specialty board stirred up a hornet’s nest in September when it said gynecologists could not treat male patients. It has since carved out limited exceptions to that ban.,Other,/2013/12/24/health/gynecologys-gender-question.html?searchResultPosition=501
423,2014-01-09,Arts,Awards Season,"My, How You’ve Changed!","Supporting actor Oscar hopefuls like Jared Leto, Bradley Cooper and Jonah Hill underwent a raft of physical transformations for their roles.",Other,/2014/01/09/movies/awardsseason/supporting-actor-hopefuls-go-to-extremes.html?searchResultPosition=552
424,2014-01-11,Arts,Music,Gender Politics Wiggles Into a World Guys Staked Out,"Laura Jane Grace, formerly Tom Gabel, lead singer of Against Me!, performed on Thursday at the Music Hall of Williamsburg.",Other,/2014/01/11/arts/music/against-me-with-laura-jane-grace-rings-in-a-new-album.html?searchResultPosition=173
425,2014-01-13,Misc,Opinion,The Next Frontier in Fertility Treatment,"Transgender men and women have the right to be parents, too.",Transgender,/2014/01/13/opinion/the-next-frontier-in-fertility-treatment.html?searchResultPosition=102
426,2014-01-30,Arts,Fashion,A Barneys Campaign Embraces a Gender Identity Issue,Bruce Weber photographed nearly 20 transgender models for a catalog and magazines.,Transgender,/2014/01/30/fashion/Barneys-Bruce-Weber-transgender-models.html?searchResultPosition=104
427,2014-02-02,US New,New York,Passions in a Pastor’s Wake,"Lafayette Avenue Presbyterian Church chose not to renew the contract of its interim pastor, the Rev. Carmen Mason-Browne. Some say her race and her gender influenced the decision.",Other,/2014/02/02/nyregion/passions-in-a-pastors-wake.html?searchResultPosition=566
428,2014-02-16,Misc,Sunday Review,"Transgender, Schlumpy and Human",We finally have transgender characters in movies and TV. But what about transgender actors?,Transgender,/2014/02/16/opinion/sunday/boylan-transgender-schlumpy-and-human.html?searchResultPosition=43
429,2014-02-17,Sports,Olympics,Transgender Former Member of Italian Parliament Detained in Sochi,"Vladimir Luxuria was detained by Russian authorities Sunday after holding up a sign that said, “Gay Is OK,” in the Olympic Park, according to the leader of an Italian gay rights group.",Transgender,/2014/02/17/sports/olympics/transgender-former-member-of-italian-parliament-detained-in-sochi.html?searchResultPosition=66
430,2014-02-21,Arts,Art & Design,‘Queer Threads: Crafting Identity and Community’,"This exhibition posits fiber art as the ideal lesbian, gay, bisexual and transgender medium.",Transgender,/2014/02/21/arts/design/queer-threads-crafting-identity-and-community.html?searchResultPosition=170
431,2014-02-22,Misc,Sunday Review,The Courage of Transgender Soldiers,Why does the U.S. military still define gender nonconformity as a disorder?,Transgender,/2014/02/22/opinion/sunday/baird-the-courage-of-trans-soldiers.html?searchResultPosition=44
432,2014-02-22,US New,New York,Terror Case Has Lawyer With Several Distinctions,"Zoë J. Dolan said she had not raised her transgender background with her client Sulaiman Abu Ghaith, a son-in-law of Osama bin Laden, who is about to stand trial in Manhattan.",Transgender,/2014/02/22/nyregion/terror-case-has-lawyer-with-several-distinctions.html?searchResultPosition=140
433,2014-02-28,US New,U.S.,"D.C. Insurance Must Cover Treatment for Transgender Residents, Mayor Says",The announcement by Mayor Vincent C. Gray reiterates that gender dysphoria — a diagnosis for psychological discomfort with one’s sex — is a recognized medical condition.,Transgender,/2014/02/28/us/dc-insurance-must-cover-treatment-for-transgender-residents-mayor-says.html?searchResultPosition=64
434,2014-03-01,Misc,Opinion,Transgender Soldiers,Vivian Taylor of Integrity USA responds to a Sunday Review article.,Transgender,/2014/03/01/opinion/transgender-soldiers.html?searchResultPosition=90
435,2014-03-04,Arts,Media,P.R. Agency Adds L.G.B.T. Practice,"MWW said it would acquire and absorb the Macias Media Group in Los Angeles, which focuses on lesbian, gay, bisexual and transgender consumers.",Transgender,/2014/03/04/business/media/pr-agency-adds-lgbt-practice.html?searchResultPosition=118
436,2014-03-13,Arts,Fashion,In Their Own Terms,"From art to advertising, and on hit television shows, transgender presence is growing.",Transgender,/2014/03/13/fashion/the-growing-transgender-presence-in-pop-culture.html?searchResultPosition=101
437,2014-03-16,US New,Americas,"Transgender Models Prosper in Brazil, Where Carnival and Faith Reign","Transgender models are enjoying success in Brazil, where crossing gender lines is increasingly accepted, but they say that the nation’s conservatism can also create a hostile environment.",Transgender,/2014/03/16/world/americas/transgender-models-prosper-in-brazil-where-carnival-and-faith-reign.html?searchResultPosition=61
438,2014-04-13,US New,Education Life,Because Ze Said So,Gender-neutral terms are gaining ground at more liberal campuses.,Other,/2014/04/13/education/edlife/because-ze-said-so.html?searchResultPosition=127
439,2014-04-15,Misc,Opinion,Unmet Promise on Discrimination,President Obama has failed to honor a pledge to ban discrimination by federal contractors based on sexual orientation or gender identity.,Other,/2014/04/15/opinion/unmet-promise-on-discrimination.html?searchResultPosition=94
440,2014-04-23,Arts,Theater,"A Cold War Casualty, Hot for Freedom (and Heels)","“Hedwig and the Angry Inch,” about a transgendered performer with issues, is on Broadway at the Belasco Theater.",Transgender,/2014/04/23/theater/hedwig-and-the-angry-inch-stars-neil-patrick-harris.html?searchResultPosition=533
441,2014-04-26,Misc,Opinion,Transgender Rights in India,A welcome ruling by the nation’s Supreme Court ensures fundamental protections.,Transgender,/2014/04/26/opinion/transgender-rights-in-india.html?searchResultPosition=39
442,2014-05-12,US New,U.S.,Hagel ‘Open’ to Reviewing Military’s Ban on Transgender People,"Defense Secretary Chuck Hagel said the armed forces should “continually” review its prohibition, calling into question whether the ban may eventually be lifted.",Transgender,/2014/05/12/us/hagel-open-to-review-of-military-policy-on-transgender-people.html?searchResultPosition=45
443,2014-05-15,Misc,Opinion,Discrimination in the Military,The Pentagon needs to address its unfounded prohibition on transgender people.,Transgender,/2014/05/15/opinion/discrimination-in-the-military.html?searchResultPosition=84
444,2014-05-15,US New,U.S.,Pentagon Weighs Transfer of Chelsea Manning to Civilian Facility,"Private Manning, serving a 35-year sentence for leaking classified documents, has requested treatment for hormone therapy for gender dysphoria.",Other,/2014/05/15/us/pentagon-weighs-transfer-of-chelsea-manning-to-civilian-facility.html?searchResultPosition=86
445,2014-05-17,Misc,Opinion,What Is This Child Doing in Prison?,"The transgender teenager needs treatment, not isolation.",Transgender,/2014/05/17/opinion/what-is-this-child-doing-in-prison.html?searchResultPosition=85
446,2014-05-25,Misc,Sunday Review,Who Are Women’s Colleges For?,Applications from transgender students and a Title IX ruling are forcing women’s colleges to reconsider admissions.,Transgender,/2014/05/25/opinion/sunday/who-are-womens-colleges-for.html?searchResultPosition=83
447,2014-05-27,Misc,Opinion,Aiding Turkey’s Gay Inmates,"Ankara’s proposal to segregate gay, lesbian and transgender prisoners will do more harm than good.",Transgender,/2014/05/27/opinion/aiding-turkeys-gay-inmates.html?searchResultPosition=153
448,2014-05-27,Misc,Opinion,Leadership on Transgender Civil Rights,"If New York is to fill a gap in its civil rights protections, the governor will have to work on the recalcitrant State Senate.",Transgender,/2014/05/27/opinion/leadership-on-transgender-civil-rights.html?searchResultPosition=35
449,2014-06-01,Life,Travel,The Evolving World of Gay Travel,The number of places where L.G.B.T. travelers can be themselves has grown exponentially and same-sex marriage laws are transforming cities into travel destinations.,Other,/2014/06/01/travel/the-evolving-world-of-gay-travel.html?searchResultPosition=82
450,2014-06-01,Misc,Magazine,Laverne Cox: ‘Blending In Was Never an Option’,"The actress on the burdens of representing the transgender community, both on-screen and off.",Transgender,/2014/06/01/magazine/laverne-cox-blending-in-was-never-an-option.html?searchResultPosition=78
451,2014-06-04,Misc,Opinion,Women’s Colleges,A rising sophomore at Brown University argues that transgender students should be welcome in a traditionally “safe space.”,Transgender,/2014/06/04/opinion/womens-colleges.html?searchResultPosition=339
452,2014-06-10,Misc,Opinion,Progress on Transgender Rights and Health,"Advancements include Medicare covering gender reassignment surgery, an evaluation of the military’s senseless ban on transgender service and Maryland’s law extending civil rights protections.",Transgender,/2014/06/10/opinion/progress-on-transgender-rights-and-health.html?searchResultPosition=33
453,2014-06-13,Misc,Opinion,Under the Skin,The next fight for transgender insurance equality will happen in the states.,Transgender,/2014/06/13/opinion/the-next-fight-for-transgender-insurance-equality.html?searchResultPosition=72
454,2014-06-21,US New,Politics,Obama Extends Marriage Benefits to Gay Couples ,"After decades of blocking gay married couples from receiving the same benefits as their heterosexual counterparts, most federal agencies will now treat married couples alike, regardless of gender.",Other,/2014/06/21/us/politics/obama-to-extend-array-of-marriage-benefits-to-gay-couples.html?searchResultPosition=370
455,2014-06-22,Life,Love,"Hilary Meyer, Nora Nolan","Ms. Meyer works with national programs for gay, lesbian, bisexual and transgender elders, and Ms. Nolan is a forensic accountant.",Transgender,/2014/06/22/fashion/weddings/hilary-meyer-nora-nolan.html?searchResultPosition=157
456,2014-06-22,Life,Real Estate,A Guide Who Knows the Turf,"Tama Robertson is among the brokers who specialize in lesbian, gay, bisexual and transgender clients.",Transgender,/2014/06/22/realestate/a-broker-for-lesbian-gay-bisexual-and-transgender-clients.html?searchResultPosition=71
457,2014-07-12,Misc,Opinion,Taxpayer-Financed Bigotry,"President Obama should resist pressure to weaken a promised executive order to bar federal contractors from discriminating against gay men, lesbians and transgender people.",Transgender,/2014/07/12/opinion/new-rules-should-ban-discrimination-by-federal-contractors.html?searchResultPosition=51
458,2014-07-15,US New,Politics,Group of Law Professors Urges Obama to Deny Religious Exemption in Order,The order would bar federal contractors from discriminating on the basis of sexual orientation and gender identity.,Other,/2014/07/15/us/politics/group-of-law-professors-urges-obama-to-deny-religious-exemption-in-order.html?searchResultPosition=189
459,2014-07-19,US New,Politics,Obama to Issue Order Barring Anti-Gay Bias by Contractors,"An executive order protecting gay, lesbian, bisexual and transgender employees from discrimination by companies that do federal government work will not include an exemption sought by many religious groups.",Transgender,/2014/07/19/us/politics/obama-to-extend-protections-for-gay-workers-with-no-religious-exemption.html?searchResultPosition=40
460,2014-07-20,Arts,Movies,A Festival Starts With the Sensual,"Karim Aïnouz’s “Futuro Beach” is the pungently sensual opening-night film of this year’s NewFest: The New York Lesbian, Gay, Bisexual & Transgender Film Festival.",Transgender,/2014/07/20/movies/a-festival-starts-with-the-sensual.html?searchResultPosition=135
461,2014-07-22,Misc,Opinion,Obama’s Bold Order on Bias ,"The president rightly used his executive authority to prohibit federal contractors from discriminating against gays, lesbians and transgender people.",Transgender,/2014/07/22/opinion/Obamas-Bold-Order-on-Bias.html?searchResultPosition=34
462,2014-07-23,Arts,Media,"In Search for Gay Characters, Don’t Turn to Action or Fantasy Films","A new study by Glaad finds only four significant lesbian, gay, bisexual and transgender characters in 43 action, science fiction and fantasy films.",Transgender,/2014/07/23/business/media/in-search-for-gay-characters-dont-turn-to-action-or-fantasy-films.html?searchResultPosition=147
463,2014-07-25,US New,U.S.,Housing Dispute Puts Quaker University at Front of Fight Over Transgender Issues,"George Fox University near Portland, Ore., has become the latest front in the fight over what defines a person’s gender, and who gets to decide.",Transgender,/2014/07/25/us/transgender-student-fights-for-housing-rights-at-george-fox-university.html?searchResultPosition=32
464,2014-07-28,Misc,Opinion,Countering Anti-Gay Bias,The presidential order barring federal contractors from sexual-orientation or gender-identity discrimination may also help the fight against H.I.V./AIDS.,Other,/2014/07/28/opinion/Countering-Anti-Gay-Bias.html?searchResultPosition=648
465,2014-08-31,US New,U.S.,"Community Makes Itself Known, With Discretion","In mostly conservative and religious Lubbock, the lesbian, gay, bisexual and transgender community is gradually growing comfortable with stepping out at an annual festival.",Transgender,/2014/08/31/us/community-makes-itself-known-with-discretion.html?searchResultPosition=245
466,2014-08-31,Misc,Magazine,Can Jill Soloway Do Justice to the Trans Movement?,"With her new show, “Transparent,” the director ventures into a world in which some of the smallest words in our language — pronouns — can cause the greatest offense.",Other,/2014/08/31/magazine/can-jill-soloway-do-justice-to-the-trans-movement.html?searchResultPosition=30
467,2014-09-06,Arts,Music,The Arc of a Transgender Life,"“As One,” Laura Kaminsky’s chamber opera about a transgender protagonist, has debuted at the Brooklyn Academy of Music.",Transgender,/2014/09/06/arts/music/as-one-has-its-premiere-in-brooklyn.html?searchResultPosition=47
468,2014-09-27,Arts,Television,Dad Has a Surprise for the Kids,"Amazon begins streaming “Transparent,” a series in which Jeffrey Tambor portrays a transitioning parent.",Other,/2014/09/27/arts/television/transparent-with-jeffrey-tambor-begins-on-amazon.html?searchResultPosition=26
469,2014-10-04,US New,New York,"Lily McBeth, a Focal Figure for Transgender Rights, Dies at 80",A substitute teacher drew national attention after wanting to return to the classroom following a sex-change operation.,Transgender,/2014/10/04/nyregion/lily-mcbeth-a-focal-figure-for-transgender-rights-dies-at-80.html?searchResultPosition=23
470,2014-10-08,US New,New York,Easing the Law for New Yorkers Shifting Gender,"The proposals would lighten a burden for many New Yorkers wading through the bureaucratic labyrinths of employment applications and pension benefits, among others.",Other,/2014/10/08/nyregion/easing-the-law-for-new-yorkers-shifting-gender.html?searchResultPosition=24
471,2014-10-19,Misc,Magazine,When Women Become Men at Wellesley,Can women’s colleges survive the transgender movement?,Transgender,/2014/10/19/magazine/when-women-become-men-at-wellesley-college.html?searchResultPosition=22
472,2014-11-05,Misc,The Upshot,"Nevada Could Elect First Openly Transgender State Legislator, a Republican","Lauren Scott is running in a Democratic-leaning Reno-area district, but strong Republican turnout puts her in striking distance.",Transgender,/2014/11/05/upshot/nevada-could-elect-first-openly-transgender-state-legislator-a-republican.html?searchResultPosition=16
473,2014-11-08,World News,Asia Pacific,Malaysian Court Overturns Islamic Law Banning Cross-Dressing,"The decision struck down a law in the state of Negeri Sembilan that prohibited men from engaging in transgender practices, including posing as women.",Transgender,/2014/11/08/world/asia/malaysian-court-overturns-islamic-law-banning-cross-dressing.html?searchResultPosition=19
474,2014-11-16,Arts,Book Review,"‘Man Alive,’ by Thomas Page McBee",A transgender writer’s memoir of forgiveness and discovery.,Transgender,/2014/11/16/books/review/man-alive-by-thomas-page-mcbee.html?searchResultPosition=17
475,2014-11-20,Arts,Style,"At a Gay-Specific Bookstore, Just Books on a Shelf Won’t Do  ","A gay bookstore gets a new home in the Lesbian, Gay, Bisexual and Transgender Community Center in Greenwich Village.",Transgender,/2014/11/20/style/at-a-gay-specific-bookstore-just-books-on-a-shelf-wont-do-.html?searchResultPosition=15
476,2014-11-22,Life,Your Money,Private Banking Firms Turn to Niche Marketing for Clients,"Firms are creating units to serve a variety of ethnic groups, races, genders and members of the lesbian, gay, bisexual and transgender communities.",Transgender,/2014/11/22/your-money/private-banking-firms-turn-to-niche-marketing-for-clients.html?searchResultPosition=13
477,2014-11-25,US New,New York,"Leslie Feinberg, Writer and Transgender Activist, Dies at 65 ","Feinberg’s 1993 novel, “Stone Butch Blues,” is considered a landmark in the contemporary literature of gender complexity.",Transgender,/2014/11/25/nyregion/leslie-feinberg-writer-and-transgender-activist-dies-at-65.html?searchResultPosition=9
478,2014-12-05,US New,U.S.,"Rights Bill Sought for Lesbian, Gay, Bisexual and Transgender Americans","As same-sex marriage gains ground, advocates are planning to seek broader protections akin to those provided for women and racial minorities in 1964.",Transgender,/2014/12/05/us/advocates-seek-civil-rights-bill-for-lesbian-gay-bisexual-and-transgender-americans.html?searchResultPosition=5
479,2014-12-11,US New,New York,"A Gay Center Is Remade, but a Glittering Nod to the Past Survives","The rough edges may be gone at the Lesbian, Gay, Bisexual and Transgender Community Center in Manhattan, but disco balls will remain.",Transgender,/2014/12/11/nyregion/a-gay-center-is-renovated-but-a-glittering-nod-to-the-past-survives-.html?searchResultPosition=12
480,2014-12-11,Arts,Style,"Our Lady J Evolves, One Dolly Parton Cover at a Time","The transgender performer Our Lady J keeps evolving, from a pianist to a cabaret singer to a writer for an Amazon original series.",Transgender,/2014/12/11/style/our-lady-j-evolves-one-dolly-parton-cover-at-a-time.html?searchResultPosition=11
481,2014-12-11,US New,New York,"Insurers in New York Must Cover Gender Reassignment Surgery, Cuomo Says",Gov. Andrew M. Cuomo is warning insurance companies that they will not be able to deny gender reassignment surgery or other treatment if a doctor says it is medically necessary.,Other,/2014/12/11/nyregion/in-new-york-insurance-must-cover-sex-changes-cuomo-says.html?searchResultPosition=10
482,2014-12-13,US New,New York,Barnard Considers Policy for Transgender Students,The women’s college is considering adopting a formal admissions policy as it and other single-sex schools grapple with shifting notions of gender.,Transgender,/2014/12/13/nyregion/barnard-weighs-policy-for-transgender-students.html?searchResultPosition=3
483,2014-12-16,World News,Asia Pacific,Murder Charge Is Recommended for U.S. Marine in Death of Transgender Filipino,"Prosecutors opted not to file for the lesser offense of homicide because of aggravating circumstances, including the violent nature of the woman’s death.",Transgender,/2014/12/16/world/asia/murder-charge-is-recommended-for-us-marine-in-death-of-transgender-filipino.html?searchResultPosition=4
484,2014-12-19,Misc,Opinion,Insurance Fairness for Transgender People,"In a move to protect the civil rights of New Yorkers, Gov. Andrew Cuomo is making sure that gender reassignment surgery and other treatments are covered.",Transgender,/2014/12/19/opinion/insurance-fairness-for-transgender-people.html?searchResultPosition=2
485,2014-12-21,Life,Job Market,"Standing Out, Uncomfortably, in a First Job ",The night shift at a deli gave a young New York transplant a look at a grittier side of life.,Other,/2014/12/21/jobs/standing-out-uncomfortably-in-a-first-job.html?searchResultPosition=535
486,2015-01-07,Misc,Opinion,How to Save Your Life,Transgender teenagers need faith in the future.,Transgender,/2015/01/07/opinion/a-response-to-leelah-alcorns-suicide-note.html?searchResultPosition=232
487,2015-01-09,Misc,Opinion,Helping the Transgendered,A reader pays tribute to her brother’s courage in his transition and his work on health care rights for others like him.,Transgender,/2015/01/09/opinion/helping-the-transgendered.html?searchResultPosition=746
488,2015-01-10,World News,Europe,European Official Criticizes Russian Law Banning Transgender Drivers,"The Council of Europe’s human rights commissioner, Nils Muiznieks, called the new law “ridiculous.”",Transgender,/2015/01/10/world/europe/nils-muiznieks-criticizes-russian-law-ban-transgender-driving.html?searchResultPosition=152
489,2015-01-12,Arts,Awards Season,Golden Globe Awards Winners Include ‘Boyhood’ and ‘The Grand Budapest Hotel’,"“Transparent,” Showtime’s “The Affair” and the FX series “Fargo” were named the top television series.",Other,/2015/01/12/movies/awardsseason/golden-globes-2015.html?searchResultPosition=341
490,2015-01-13,Arts,Media,"With Win, Amazon Shakes Up Yet Another Industry","A nemesis for publishers, Amazon collected a Golden Globe for “Transparent,” becoming the first digital streaming service to win one for best TV series.",Other,/2015/01/13/business/media/award-for-transparent-vindicates-amazons-tv-executives.html?searchResultPosition=372
491,2015-01-14,World News,Asia Pacific,State in India Plans to Help Gay Youth ‘Get Over Same-Sex Feelings’ ,"The state of Goa in India, where homosexual relations are illegal, plans to treat teenagers who say they are gay, bisexual or transgender with programs that include counseling.",Transgender,/2015/01/14/world/asia/indian-goa-program-counsel-gay-youths-to-become-straight.html?searchResultPosition=280
492,2015-01-14,Life,Business,Saks Owner Denies Bias Claim by a Transgender Former Employee ,"The chief executive of Saks Fifth Avenue’s parent company denied accusations made by a former employee that she was harassed, then dismissed, over her transgender identity.",Transgender,/2015/01/14/business/saks-owner-denies-bias-claim-by-a-transgender-former-employee.html?searchResultPosition=157
493,2015-01-14,US New,New York,New Bronx Senior Center Aims to Provide a More Welcoming Atmosphere,"The space, which will offer programs and hot lunches, is part of a $1.5 million expansion of services for older lesbian, gay, bisexual and transgender people.",Transgender,/2015/01/14/nyregion/a-new-center-in-the-bronx-will-focus-on-gay-seniors.html?searchResultPosition=235
