,Date,Category,Section,Headline,Subheader,Term,URL
799,2016-08-24,Misc,Opinion,More Attacks on Transgender Rights,A federal judge’s ruling on the Department of Education’s guidance for transgender students shouldn’t prevent schools from adhering to them.,Transgender,/2016/08/24/opinion/more-attacks-on-transgender-rights.html?searchResultPosition=55
800,2016-08-26,Arts,Television,What’s on TV Friday: ‘The Danish Girl’ and ‘The Kicks’,"Eddie Redmayne portrays the transgender pioneer Lili Elbe in “The Danish Girl,” and a young soccer player gets her mojo back in “The Kicks.”",Transgender,/2016/08/26/arts/television/whats-on-tv-friday-the-danish-girl-and-the-kicks.html?searchResultPosition=299
801,2016-08-27,US New,U.S.,Federal Judge Curbs Enforcement of North Carolina Transgender Access Law,"The ruling against the law, which restricted restroom access, is an indication that the measure will continue to face a difficult road ahead.",Transgender,/2016/08/27/us/federal-judge-curbs-enforcement-of-north-carolina-transgender-access-law.html?searchResultPosition=56
802,2016-08-28,Arts,Book Review,Tim Parks Laments the Excessive Influence of International Book Fairs,"Even when finely translated, not all good books travel well across cultures.",Other,/2016/08/28/books/review/tim-parks-laments-the-excessive-influence-of-international-book-fairs.html?searchResultPosition=822
803,2016-09-01,Science,Personal Tech,Video Games Allow Characters More Varied Sexual Identities,"Video games have become more inclusive regarding gender and sexuality, adding features to accommodate L.G.B.T. players.",Other,/2016/09/01/technology/personaltech/video-games-allow-characters-more-varied-sexual-orientations.html?searchResultPosition=61
804,2016-09-11,Arts,Theater,"Between ‘Transparent’ Seasons, Judith Light Isn’t Playing Nice",The actress will return to the stage in Neil LaBute’s “All the Ways to Say I Love You.”,Other,/2016/09/11/theater/between-transparent-seasons-judith-light-isnt-playing-nice.html?searchResultPosition=812
805,2016-09-11,Misc,Magazine,"For Gay and Transgender Teens, Will It Get Better?",School life can be hell for teenagers who don’t identify as straight. One refuge? The internet.,Transgender,/2016/09/11/magazine/for-gay-and-transgender-teens-will-it-get-better.html?searchResultPosition=47
806,2016-09-14,US New,U.S.,"Chelsea Manning Told She Can Have Gender Reassignment Surgery, Lawyer Says","Ms. Manning, who is in military prison for leaking government files, was told the Army will allow the operation.",Other,/2016/09/14/us/chelsea-manning-told-she-can-have-gender-reassignment-surgery-lawyer-says.html?searchResultPosition=51
807,2016-09-14,US New,U.S.,N.C.A.A. Leaves North Carolina in a New Spot: Sapped of Sports Pride,"The N.C.A.A., frustrated by a North Carolina law restricting gay and transgender rights, will not host seven championship events in the state.",Transgender,/2016/09/14/us/ncaa-leaves-north-carolina-in-a-new-spot-sapped-of-sports-pride.html?searchResultPosition=52
808,2016-09-18,Misc,Magazine,How Two Producers of ‘Transparent’ Made Their Own Trans Lives More Visible,The photos Zackary Drucker and Rhys Ernst took of each other showed a young couple in love. They became an important public record of transgender life.,Transgender,/2016/09/18/magazine/how-two-producers-of-transparent-are-making-trans-lives-more-visible-starting-with-their-own.html?searchResultPosition=53
809,2016-09-29,Arts,Television,‘Transparent’ Season 3: Watched It All? Let’s Talk,"Season 3, if a bit slow in terms of character, was the show’s most stylistically innovative to date. It also tackled some exceptionally weighty themes.",Other,/2016/09/29/arts/television/transparent-season-3-recap.html?searchResultPosition=359
810,2016-09-29,Arts,Style,"A Trans Life, Captured by Mark Seliger","In his new book, the photographer Mark Seliger documents the transgender community drawn to the cultural melting pot of Christopher Street.",Transgender,/2016/09/29/style/transgender-christopher-street-photography-book-mark-seliger.html?searchResultPosition=40
811,2016-10-02,US New,New York,"Poor, Transgender and Dressed for Arrest","When bourgeois women talk about the policing of female sexuality, they are often speaking in metaphors, but poor women are frequently talking about something literal.",Transgender,/2016/10/02/nyregion/poor-transgender-and-dressed-for-arrest.html?searchResultPosition=39
812,2016-10-06,US New,New York,"For Transgender Youths in New York, It Would Be a Health Care Milestone",The state wants its Medicaid program to allow minors being treated for gender dysphoria to receive coverage for hormone therapy.,Transgender,/2016/10/06/nyregion/new-york-moves-to-allow-medicaid-to-cover-hormone-therapy-for-transgender-youth.html?searchResultPosition=35
813,2016-10-06,Arts,The Learning Network,"Civil Conversation Challenge for Teenagers | Issue 4: Race, Gender and Identity","Both presidential candidates are increasingly staking their fortunes on these cultural issues that, The Times writes, are “convulsing the nation.” What do you think?",Other,/2016/10/06/learning/civil-conversation-challenge-for-teenagers-issue-4-race-gender-and-identity.html?searchResultPosition=450
814,2016-10-08,Arts,Television,"Young, Transgender and Acting on TV","Agents, writers, producers and parents are gingerly exploring a frontier within a frontier as they bring young transgender actors into the fold.",Transgender,/2016/10/08/arts/television/young-transgender-and-acting-on-tv.html?searchResultPosition=33
815,2016-10-16,Misc,Sunday Review,Is It Time to Desegregate the Sexes?,"The fiercest battleground between gender inclusivity and bodily privacy is the locker room, not the bathroom.",Other,/2016/10/16/opinion/sunday/is-it-time-to-desegregate-the-sexes.html?searchResultPosition=34
816,2016-10-16,Arts,Book Review,Questioning Gender Amid a Chaotic East Village Childhood,"iO Tillett Wright’s debut memoir, “Darling Days,” is about growing up in the bohemian East Village of the 1980s and ’90s.",Other,/2016/10/16/books/review/io-tillett-wright-darling-days-memoir.html?searchResultPosition=552
817,2016-10-17,Science,Health,"Living as a Man, Fighting Breast Cancer: How Trans People Face Care Gaps","Though awareness of the nation’s transgender population has grown, medical networks are still scrambling to catch up with that group’s highly specialized needs.",Transgender,/2016/10/17/health/transgender-health-care-breast-cancer.html?searchResultPosition=31
818,2016-10-20,Sports,Hockey,"Just Being Himself, in a Professional Women’s Hockey League","He goes by a different name and pronoun now, but Harrison Browne of the National Women’s Hockey League says coming out as a transgender man has been freeing.",Transgender,/2016/10/20/sports/hockey/harrison-browne-transgender-hockey-player.html?searchResultPosition=32
819,2016-10-20,Misc,Opinion,"The A.C.L.U., on Transgender Students",The A.C.L.U. writes that school administrators include transgender students in common spaces “without any doomsday prophecies ever coming to pass.”,Transgender,/2016/10/20/opinion/the-aclu-on-transgender-students.html?searchResultPosition=137
820,2016-10-27,Misc,Opinion,Don’t Use Girls as Props to Fight Trans Rights,All students are at risk if schools embrace too narrow a vision of what a woman is supposed to be.,Other,/2016/10/27/opinion/dont-use-girls-as-props-to-fight-trans-rights.html?searchResultPosition=29
821,2016-10-29,US New,Politics,Supreme Court to Rule in Transgender Access Case,The question at issue involves a Virginia high school student and a federal directive that effectively expanded a Title IX definition of discrimination.,Transgender,/2016/10/29/us/politics/supreme-court-to-rule-in-transgender-access-case.html?searchResultPosition=28
822,2016-11-02,Arts,Theater,"Review: In ‘Sagittarius Ponderosa,’ New Self Confronts Old","This MJ Kaufman play centers on a transgender character who finds solace in an enormous tree as he deals with issues of identity, intimacy and family.",Transgender,/2016/11/02/theater/review-sagittarius-ponderosa.html?searchResultPosition=300
823,2016-11-11,US New,U.S.,Roy Cooper Holds Thin Lead Over Gov. Pat McCrory in North Carolina,"If Mr. Cooper’s lead holds, it would be a bright spot for Democrats in a race dominated by the state’s transgender bathroom law.",Transgender,/2016/11/11/us/roy-cooper-holds-thin-lead-over-gov-pat-mccrory-in-north-carolina.html?searchResultPosition=25
824,2016-11-11,US New,Politics,Trump Victory Alarms Gay and Transgender Groups,"The president-elect has shown no history of personal animus toward gay people, but the Republican platform and his running mate both oppose gay rights.",Transgender,/2016/11/11/us/politics/trump-victory-alarms-gay-and-transgender-groups.html?searchResultPosition=18
825,2016-11-13,Arts,Theater,Transgender Playwrights: ‘We Should Get to Tell Our Own Stories First’,"The playwrights MJ Kaufman, Basil Kreimendahl and Jess Barbagallo discuss attitudes toward transgender artists, and their own recent works.",Transgender,/2016/11/13/theater/transgender-playwrights-we-should-get-to-tell-our-own-stories-first.html?searchResultPosition=22
826,2016-11-14,US New,Politics,"As Transition Pace Picks Up, Trump Nears Cabinet Nominations","A week after his stunning election victory, the president elect is closing in on picks for posts such as the secretaries of state and of the Treasury, and attorney general.",Other,/2016/11/14/us/politics/donald-trump-transition.html?searchResultPosition=826
827,2016-11-16,World News,Canada,Canada Takes Steps to Address Discriminatory Policies Against Gays,"A new measure will make the age of consent 16 for anal sex, and a government appointee will look into cases of federal discrimination against gay and transgender people.",Transgender,/2016/11/16/world/canada/canada-lgtb-discrimination.html?searchResultPosition=316
828,2016-11-16,Arts,Fashion,Transgender on Tinder? Now You Can Identify Yourself That Way,The dating app says the change will cut down on harassment and complaints that caused people to be barred from the service.,Transgender,/2016/11/16/technology/tinder-transgender-identity.html?searchResultPosition=16
829,2016-11-20,Arts,Style,L.G.B.T. Gamers Huddle for a Postelection Reality Check,"GaymerX East, a convention that embraces gender diversity in gaming, took place amid fears of a Trump-era backlash.",Other,/2016/11/20/style/lgbt-gamers-gaymerx-east-presidential-election.html?searchResultPosition=20
830,2016-11-22,Sports,Hockey,Pay Cuts Jolt Women’s Pro League and Leave Its Future Uncertain,"After players learned their salaries would be cut by about 38 percent to keep the National Women’s Hockey League afloat, they called for more transparency from the league office.",Other,/2016/11/22/sports/hockey/nwhl-pay-cut-salary.html?searchResultPosition=801
831,2016-11-30,US New,Politics,Mike Pence and ‘Conversion Therapy’: A History,The vice president-elect has denied that he supports discredited methods meant to change a person’s sexual orientation or gender identity.,Other,/2016/11/30/us/politics/mike-pence-and-conversion-therapy-a-history.html?searchResultPosition=17
832,2016-12-02,Misc,Opinion,"Really, You’re Blaming Transgender People for Trump?",Don’t call my rights a luxury that Democrats can’t afford to defend.,Transgender,/2016/12/02/opinion/really-youre-blaming-transgender-people-for-trump.html?searchResultPosition=4
833,2016-12-07,World News,Europe,"Malta Outlaws ‘Conversion Therapy,’ a First in Europe","The Mediterranean island nation criminalized therapeutic methods that purport to change a person’s sexual orientation or gender identity, officials said.",Other,/2016/12/07/world/europe/malta-outlaws-conversion-therapy-transgender-rights.html?searchResultPosition=15
834,2016-12-09,Arts,Television,"Will ‘Skam,’ a Norwegian Hit, Translate?",This intense series about a group of teenagers has been a success across multiple platforms. Now there are plans for an English-language version.,Other,/2016/12/09/arts/television/will-skam-a-norwegian-hit-translate.html?searchResultPosition=742
835,2016-12-09,Arts,Theater,"Review: Transgender ‘Street Children,’ Out on a Pier","Pia Scala-Zankel’s play, a Vertigo Theater production at the New Ohio Theater, follows youths living on the streets of New York in the 1980s.",Transgender,/2016/12/09/theater/review-transgender-street-children-out-on-a-pier.html?searchResultPosition=151
836,2016-12-19,US New,U.S.,North Carolina Limits on Transgender Rights Appear Headed for Repeal,"The state’s General Assembly is expected to rescind the contentious state law cutting legal protections for lesbian, gay, bisexual and transgender people.",Transgender,/2016/12/19/us/north-carolina-limits-on-transgender-rights-may-be-headed-for-repeal.html?searchResultPosition=3
837,2016-12-21,US New,U.S.,North Carolina Fails to Repeal Bathroom Law That Prompted Boycotts,"Despite bipartisan support, a special session of the legislature did not reach a deal to repeal a law limiting legal protections for lesbian, gay, bisexual and transgender people.",Transgender,/2016/12/21/us/north-carolina-fails-to-repeal-bathroom-law-that-prompted-boycotts.html?searchResultPosition=12
838,2016-12-21,Arts,Movies,The Gender-Fluid Performer Who Changed the Academy’s Mind,Kelly Mantle became the first performer eligible for best supporting actor or actress; the news drew an emotional outpouring. But he has taken it all in stride.,Other,/2016/12/21/movies/oscars-kelly-mantle-gender-fluid-performer.html?searchResultPosition=11
839,2016-12-22,Misc,Opinion,North Carolina Doubles Down on Bigotry,The failure to repeal a law that targets gay and transgender people is a travesty for all residents.,Transgender,/2016/12/22/opinion/north-carolina-doubles-down-on-bigotry.html?searchResultPosition=7
840,2016-12-22,Misc,Opinion,Super Mario Run’s Not-So-Super Gender Politics,More and more girls and women play video games. So why does Nintendo still design them like it’s 1985?,Other,/2016/12/22/opinion/super-mario-runs-not-so-super-gender-politics.html?searchResultPosition=615
841,2016-12-22,US New,Politics,Transition Team’s Request on Gender Equality Rattles State Dept.,The Trump team’s request made employees at the agency wonder if the incoming administration was planning to roll back changes first made by Hillary Clinton.,Other,/2016/12/22/us/politics/state-department-gender-equality-trump-transition.html?searchResultPosition=10
842,2016-12-26,Sports,Hockey,Fledgling Women’s Hockey League Becomes a Trailblazer on Transgender Policy,"The National Women’s Hockey League, in just its second season, planned to unveil rules to protect transgender players.",Transgender,/2016/12/26/sports/womens-hockey-league-transgender.html?searchResultPosition=1
843,2016-12-30,US New,U.S.,Cub Scouts Kick Out Transgender Boy in New Jersey,"Three years after the Boy Scouts ended its ban on openly gay youths, Joe Maldonado, 8, was ejected from the Cub Scouts because he is transgender.",Transgender,/2016/12/30/us/cub-scouts-transgender.html?searchResultPosition=2
844,2016-12-31,Arts,Fashion,"My Father, the Shapeshifter","In a book about her enigmatic father, Susan Faludi explores the very meaning of gender and identity.",Other,/2016/12/31/fashion/susan-faludi-father-in-the-darkroom.html?searchResultPosition=5
845,2017-01-02,World News,Asia Pacific,"Transgender Man Was Unfairly Fired, but Bias Not Proved, Chinese Court Says","The court ordered the company to pay the plaintiff, identified as Mr. C, 2,000 renminbi in compensation but did not grant his demand for an apology.",Transgender,/2017/01/02/world/asia/china-transgender-lawsuit.html?searchResultPosition=177
846,2017-01-04,Arts,DealBook,Women and Minorities Make Slow Progress in Filling Ranks at Law Firms,"Small gains in partnerships and associate jobs since 2009, though higher representation in summer associate classes doesn’t translate into permanent jobs.",Other,/2017/01/04/business/dealbook/law-firm-diversity-women-minorities.html?searchResultPosition=413
847,2017-01-05,World News,Asia Pacific,"With Manicures and Makeup, Japan’s ‘Genderless’ Blur Line Between Pink and Blue","Just as some American men have embraced makeup, young Japanese men are bending gender norms, a big step in a culture where genders hew strictly to convention.",Other,/2017/01/05/world/asia/with-manicures-and-makeup-japans-genderless-blur-line-between-pink-and-blue.html?searchResultPosition=797
848,2017-01-05,Arts,The Learning Network,Is Single-Sex Education Still Useful?,"With the emergence of new ideas about the fluidity of gender identity, do single-sex schools still make sense?",Other,/2017/01/05/learning/is-single-sex-education-still-useful.html?searchResultPosition=242
849,2017-01-05,US New,U.S.,Texas Moves to Limit Transgender Bathroom Access,Lt. Gov. Dan Patrick announced the filing of a bill similar to one in North Carolina last year that caused a political uproar and led to boycotts.,Transgender,/2017/01/05/us/texas-transgender-bathroom-access.html?searchResultPosition=144
850,2017-01-05,Misc,Opinion,A Black Transgender Man Attacked on the Subway,These hate crimes and incidents of harassment were reported in the last two weeks.,Transgender,/2017/01/05/opinion/a-black-transgender-man-attacked-on-the-subway.html?searchResultPosition=134
851,2017-01-07,Misc,Sunday Review,Texas’ Transgender Bill Idiocy,North Carolina’s transgender restroom measure proved disastrous. Now Republicans in Texas have introduced a similar one.,Transgender,/2017/01/07/opinion/sunday/texas-transgender-bill-idiocy.html?searchResultPosition=123
852,2017-01-10,US New,Politics,President Obama’s Farewell Address: Full Video and Text,The transcript and live video of President Obama’s farewell address in Chicago.,Other,/2017/01/10/us/politics/obama-farewell-address-speech.html?searchResultPosition=930
853,2017-01-10,US New,U.S.,Transgender Women Fear Abuse in Immigration Detention,"Lawyers and advocates say mistreatment and abuse endure, despite guidelines issued by Immigration and Customs Enforcement.",Transgender,/2017/01/10/us/transgender-women-fear-abuse-in-immigration-detention.html?searchResultPosition=132
854,2017-01-11,Arts,Music,"Juliet and Jackie Evancho, Bonding as Targets in a Trump Media Frenzy","Jackie, 16, who will sing the national anthem at the presidential inauguration, and her transgender sister, Juliet, 18, lend each other support.",Transgender,/2017/01/11/arts/music/jackie-evancho-sister-juliet-donald-trump-inauguration.html?searchResultPosition=268
855,2017-01-13,US New,U.S.,Chelsea Manning Describes Bleak Life in a Men’s Prison,The former Army intelligence analyst who disclosed files to WikiLeaks hopes to be allowed to move ahead with her gender reassignment and her life.,Other,/2017/01/13/us/chelsea-manning-sentence-obama.html?searchResultPosition=335
856,2017-01-14,Sports,College Basketball,"Transgender Bill Could Cost San Antonio $234 Million, Says Study of Final Four","A study examined how much money could be brought to San Antonio by the 2018 Final Four, which could be threatened by a Texas bill seen as discriminatory to transgender people.",Transgender,/2017/01/14/sports/ncaabasketball/texas-transgender-bill-final-four-san-antonio.html?searchResultPosition=156
857,2017-01-16,Misc,Opinion,"Issues Surrounding Betsy DeVos, the Education Nominee","Readers address Ms. DeVos’s wealth, how she would treat transgender students and her support for charter schools.",Transgender,/2017/01/16/opinion/issues-surrounding-betsy-devos-the-education-nominee.html?searchResultPosition=943
858,2017-01-18,US New,Politics,Obama’s Last News Conference: Full Transcript and Video,President Barack Obama submitted to a final round of questions from the news media on Wednesday before departing office.,Other,/2017/01/18/us/politics/obama-final-press-conference.html?searchResultPosition=937
859,2017-01-21,Arts,Fashion,These Young Adult Novels Come With Back Stories: The Authors’ Own,"Married parents, one transgender, have created a series, “Changers,” popular with teenagers who feel they were born in the wrong bodies. (Really, Mom!)",Transgender,/2017/01/21/fashion/transgender-teen-literature.html?searchResultPosition=255
860,2017-01-22,Arts,Theater,Review: An ‘Orange Julius’ Bond Is Complicated,"Memory, gender and fantasy blend in this play about a Vietnam veteran and his offspring.",Other,/2017/01/22/theater/orange-julius-review.html?searchResultPosition=473
861,2017-01-23,Science,Health,7 Young People on Their Views of Gender,Annie Tritt has been photographing young people whose sense of gender goes beyond the binary norm. These are a few of their thoughts and pictures.,Other,/2017/01/23/health/trans-gender-children-youth.html?searchResultPosition=231
862,2017-01-23,Misc,Opinion,Transgender Detainees,The National Immigrant Justice Center writes that these detainees must have access to immigration lawyers and advocates.,Transgender,/2017/01/23/opinion/transgender-detainees.html?searchResultPosition=205
863,2017-01-27,Life,Travel,Advice for Gay and Transgender Travelers,Expert advice on planning a seamless and satisfying getaway.,Transgender,/2017/01/27/travel/advice-for-gay-and-transgender-travelers.html?searchResultPosition=122
864,2017-01-28,US New,Politics,"Betsy DeVos, a Friend of L.G.B.T. Rights? Past Colleagues Say Yes","President Trump’s pick for education secretary has a history of supporting gay and transgender rights that is largely unknown, possibly because it puts her at odds with her family.",Transgender,/2017/01/28/us/politics/betsy-devos-gay-transgender-rights.html?searchResultPosition=250
865,2017-01-28,Misc,Sunday Review,How My Mom Learned to Love Her Son,She couldn’t look at me without crying when I first transitioned. Then we both changed.,Other,/2017/01/28/opinion/sunday/how-my-mom-learned-to-love-her-son.html?searchResultPosition=449
866,2017-01-30,Life,Business,How to Plan a Safe Trip for Gay and Transgender Travelers,"In many parts of the world, laws and social customs create an unwelcoming and unsafe environment for L.G.B.T. travelers, but planning ahead can reduce risks.",Transgender,/2017/01/30/business/how-to-plan-a-safe-trip-for-gay-and-transgender-travelers.html?searchResultPosition=141
867,2017-01-30,US New,Politics,Obama’s Protections for L.G.B.T. Workers Will Remain Under Trump,"The White House said Monday that President Trump would leave in place a 2014 order that created new protections for gay, lesbian, bisexual and transgender people.",Transgender,/2017/01/30/us/politics/obama-trump-protections-lgbt-workers.html?searchResultPosition=226
868,2017-01-30,US New,U.S.,"Boy Scouts, Reversing Century-Old Stance, Will Allow Transgender Boys",The Boy Scouts of America said that the group would begin accepting members based on the gender listed on their application.,Transgender,/2017/01/30/us/boy-scouts-reversing-century-old-stance-will-allow-transgender-boys.html?searchResultPosition=172
869,2017-01-31,US New,U.S.,Conservatives Alienated by Boy Scouts’ Shift on Transgender Policy,Conservative groups view the decision by the Boy Scouts of America as another sign that the organization is moving away from its traditions.,Transgender,/2017/01/31/us/boy-scouts-transgender-policy.html?searchResultPosition=168
870,2017-01-31,Life,Family,Raising a Transgender Child,One family explains their child’s change to ‘her true self.’,Transgender,/2017/01/31/well/family/raising-a-transgender-child.html?searchResultPosition=115
871,2017-02-01,US New,U.S.,Texas Mayor Announces That She Is Transgender,"Jess Herbst posted a message on the town website of New Hope, Tex., saying that she had transitioned and would no longer be known as Jeff.",Transgender,/2017/02/01/us/texas-transgender-mayor.html?searchResultPosition=143
872,2017-02-02,Misc,Opinion,Welcoming Transgender Boy Scouts,Allowing transgender boys in the Boy Scouts may help a new generation of Americans to think more compassionately and rationally about gender identity.,Transgender,/2017/02/02/opinion/welcoming-transgender-boy-scouts.html?searchResultPosition=119
873,2017-02-02,Arts,Movies,"Review: ‘This Is Everything: Gigi Gorgeous,’ a Self-Made Cover Girl","Barbara Kopple’s film documents how Gigi Gorgeous, formerly Gregory Allan Lazzarato, took control of her transgender destiny with the support of her family.",Transgender,/2017/02/02/movies/this-is-everything-gigi-gorgeous-review.html?searchResultPosition=283
874,2017-02-02,Misc,Opinion,The Boy Scouts’ Inclusiveness,A transgender woman celebrates the decision to include transgender boys in the Scouts.,Transgender,/2017/02/02/opinion/the-boy-scouts-inclusiveness.html?searchResultPosition=941
875,2017-02-03,US New,New York,How the Model Andreja Pejic Spends Her Sundays: Yoga and a ‘Pig Out’ Brunch,"Ms. Pejic, the first transgender model profiled in Vogue, also says she likes to step outside her “personal bubble” and catch up on current events.",Transgender,/2017/02/03/nyregion/sunday-routine-andreja-pejic.html?searchResultPosition=260
876,2017-02-04,Misc,NYT Now,'Not Every Company Needs to Take a Strong Political Stance’,"Our Top 10 Comments of the Week: Readers discuss #DeleteUber, transgender scouts, and the legacy of ‘Girls.’",Transgender,/2017/02/04/nytnow/top-10-comments-new-york-times.html?searchResultPosition=513
877,2017-02-04,Arts,Fashion,The ‘Esquire Man’ Is Dead. Long Live the ‘Esquire Man.’,"Esquire magazine, long the man’s bible, looks to chart a new course in an era of transgender bathrooms and pink hats.",Transgender,/2017/02/04/fashion/esquire-magazine-jay-fielden.html?searchResultPosition=768
